{
  "schema": "modelgraph/envelope/v0",
  "run": {
    "id": "run_fixture_routed",
    "graph": {
      "id": "composed-assistant",
      "version": "1.0.0",
      "hash": "sha256:bbbbbbbbbbbbbbbbbbbbbbbbbbbbbbbbbbbbbbbbbbbbbbbbbbbbbbbbbbbbbbbb"
    },
    "parent_run_id": null,
    "depth": 0,
    "step": 2,
    "path": [
      {
        "node": "domain-triage",
        "kind": "router",
        "decision": "route",
        "to": "coding",
        "confidence": 0.91,
        "reason": "The request asks for a TypeScript implementation."
      },
      {
        "node": "coding",
        "kind": "subgraph",
        "graph": "coding-specialist@1.0.0",
        "graph_hash": "sha256:cccccccccccccccccccccccccccccccccccccccccccccccccccccccccccccccc"
      }
    ],
    "budget": {
      "max_steps": 8,
      "used_steps": 4,
      "max_depth": 3,
      "max_total_tokens": 32000,
      "used_tokens": 4120,
      "max_cost_usd": 0.1,
      "used_cost_usd": 0.0,
      "max_wall_seconds": 300,
      "elapsed_seconds": 6.2,
      "on_budget_exhausted": "fail"
    },
    "started_at": "2026-10-22T10:00:00Z",
    "seed": 42
  },
  "request": {
    "task": "Write a debounce function in TypeScript.",
    "locale": "en",
    "constraints": {
      "output_format": "code",
      "max_output_tokens": 1200
    }
  },
  "inputs": [
    {
      "name": "task",
      "type": "text",
      "media_type": "text/plain",
      "content": "Write a debounce function in TypeScript.",
      "producer": "$input",
      "created_at": "2026-10-22T10:00:00Z",
      "hash": "sha256:dddddddddddddddddddddddddddddddddddddddddddddddddddddddddddddddd"
    }
  ],
  "artifacts": [
    {
      "name": "answer",
      "type": "code",
      "media_type": "text/typescript",
      "content": "export const answer = 42;",
      "producer": "js-specialist",
      "created_at": "2026-10-22T10:00:04Z",
      "hash": "sha256:eeeeeeeeeeeeeeeeeeeeeeeeeeeeeeeeeeeeeeeeeeeeeeeeeeeeeeeeeeeeeeee",
      "metadata": {
        "language": "typescript"
      }
    }
  ],
  "notes": [
    {
      "producer": "domain-triage",
      "content": "Prefer a typed utility with a usage example.",
      "created_at": "2026-10-22T10:00:01Z"
    }
  ]
}
